{
  "export_spec": {
    "version": "v1.0",
    "generated": "2025-11-03T22:41:47.906727Z",
    "source_stage": "S8-S3",
    "mode": "partner"
  },
  "metrics_summary": {
    "clarity_delta_avg": 0.0,
    "empathy_activation_rate": 0.0,
    "bias_drift_index": 0.0,
    "positive_outcome_rate": 0.0
  },
  "reciprocity_summary": {
    "spec": {
      "version": "v0.1"
    },
    "timestamp": "2025-11-03T01:25:43.005743+00:00",
    "total_events": 3,
    "unique_ids": 3,
    "avg_clarity_effect": 0.16666666666666666,
    "avg_empathy_response": 0.7000000000000001,
    "contexts": {
      "HR_PILOT": 1,
      "GPT_APP": 2
    },
    "actions": {
      "PromotionRecommendation": 1,
      "RefinedReflection": 2
    },
    "last_event_at": "2025-11-03T03:24:10+00:00",
    "by_day_last14": {
      "2025-10-21": 0,
      "2025-10-22": 0,
      "2025-10-23": 0,
      "2025-10-24": 0,
      "2025-10-25": 0,
      "2025-10-26": 0,
      "2025-10-27": 0,
      "2025-10-28": 0,
      "2025-10-29": 0,
      "2025-10-30": 0,
      "2025-10-31": 0,
      "2025-11-01": 0,
      "2025-11-02": 0,
      "2025-11-03": 3
    }
  },
  "bse_summary": {
    "dimensions": {
      "evidence": 0.6390095238095241,
      "agency": 0.37247619047619046,
      "risk": 0.6600952380952383,
      "conflict": 0.23009523809523807,
      "identity": 0.16342857142857148,
      "ambiguity": 0.01466666666666667,
      "fallacy": 0.22761904761904767,
      "context": 0.15885714285714292,
      "empathy": 0.25200000000000006
    },
    "n_vectors": 21
  },
  "partner": {
    "partner_id": "HR-PILOT-001",
    "label": "HR Pilot v1",
    "export_scope": "aggregates_only"
  }
}